<!-- $Id: tileRules.dtd,v 1.4 2004/08/23 19:52:56 dougday Exp $ -->

<!ENTITY % bool '( true | false )'>
<!ENTITY % dir '( west | north | east | south | advance | retreat | all )'>
<!ENTITY % effect '( fire | sleep | poison | poisonField | electricity | lava )'>
<!ENTITY % speed '( slow | vslow | vvslow )'>

<!ELEMENT tileRules ( rule+ ) >

<!ELEMENT rule EMPTY >
<!ATTLIST rule name               CDATA    #REQUIRED
               balloon            %bool;   #IMPLIED
               canattackover      %bool;   #IMPLIED
               canlandballoon     %bool;   #IMPLIED
               cantwalkoff        %dir;    #IMPLIED
               cantwalkon         %dir;    #IMPLIED
               chest              %bool;   #IMPLIED
               dispel             %bool;   #IMPLIED
               door               %bool;   #IMPLIED
               effect             %effect; #IMPLIED
               horse              %bool;   #IMPLIED
               lockeddoor         %bool;   #IMPLIED
               creatureunwalkable %bool;   #IMPLIED               
               replacement        %bool;   #IMPLIED
               sailable           %bool;   #IMPLIED
               ship               %bool;   #IMPLIED
               speed              %speed;  #IMPLIED
               swimable           %bool;   #IMPLIED
               talkover           %bool;   #IMPLIED
               unflyable          %bool;   #IMPLIED>
